INPUT:sent1;INPUT:sent2;INPUT:premise;INPUT:question;OUTPUT:variant;HINT:text;ASSIGNMENT:assignment_id;ASSIGNMENT:task_suite_id;ASSIGNMENT:worker_id;ASSIGNMENT:status;ASSIGNMENT:started
Казалось, это будет страшно.;Казалось, это будет весело.;Мы катались на американских горках.;Что стало причиной этого?;1;;0000b4a8a2--5e707f53aedc8301261cbb68;0000b4a8a2--5e707d5a1fcfde011aac0930;3c151aae56609e755d84f1caed80196e;APPROVED;2020-03-17T07:42:11.349
Я налил в мешок масло.;Я нагрел его в микроволновой печи.;Мешок попкорна начал трещать.;Что стало причиной этого?;1;;0000b4a8a2--5e707f53aedc8301261cbb68;0000b4a8a2--5e707d5a1fcfde011aac0930;3c151aae56609e755d84f1caed80196e;APPROVED;2020-03-17T07:42:11.349
Вода стала грязной.;Посевы погибли.;В регионе началась засуха.;Что случилось в результате?;1;;0000b4a8a2--5e707f53c29c1b0126282f8f;0000b4a8a2--5e707d5a1fcfde011aac0905;94330ac6a17187fba72722af172f9ce1;APPROVED;2020-03-17T07:42:11.440
Птица улетела.;Птица поймала червя.;Кот погнался за птицей.;Что случилось в результате?;0;;0000b4a8a2--5e707f53c29c1b0126282f8f;0000b4a8a2--5e707d5a1fcfde011aac0905;94330ac6a17187fba72722af172f9ce1;APPROVED;2020-03-17T07:42:11.440
Школьников отпустили на лето.;Она переехала в другой город.;Девочка перешла в другую школу.;Что стало причиной этого?;1;;0000b4a8a2--5e707f53c29c1b0126282f8f;0000b4a8a2--5e707d5a1fcfde011aac0905;94330ac6a17187fba72722af172f9ce1;APPROVED;2020-03-17T07:42:11.440
Владелец назначил нового менеджера.;Работники вышли на забастовку.;Владелец фабрики отказался повышать зарплату работникам.;Что случилось в результате?;1;;0000b4a8a2--5e707f53c29c1b0126282f8f;0000b4a8a2--5e707d5a1fcfde011aac0905;94330ac6a17187fba72722af172f9ce1;APPROVED;2020-03-17T07:42:11.440
Экстремисты повлияли на него.;Экстремисты убили его.;Лидер страны противодействовал экстремистам.;Что случилось в результате?;1;;0000b4a8a2--5e707f53c29c1b0126282f8f;0000b4a8a2--5e707d5a1fcfde011aac0905;94330ac6a17187fba72722af172f9ce1;APPROVED;2020-03-17T07:42:11.440
Пчела ужалила садовника.;Белки выкопали луковицы.;Нарциссы в саду погибли.;Что стало причиной этого?;1;;0000b4a8a2--5e707f53dddbf7012599b2c0;0000b4a8a2--5e707d5a1fcfde011aac08ed;e42c279b9fe9ef53df9c39e986b9e6db;APPROVED;2020-03-17T07:42:11.543
Пламя погасло.;На кончике спички появилось пламя.;Я чиркнул спичкой.;Что случилось в результате?;1;;0000b4a8a2--5e707f53dddbf7012599b2c0;0000b4a8a2--5e707d5a1fcfde011aac08ed;e42c279b9fe9ef53df9c39e986b9e6db;APPROVED;2020-03-17T07:42:11.543
Они не хотели решать спор в суде.;Они хотели восстановить свои личные взаимоотношения.;Спорящие стороны достигли соглашения.;Что стало причиной этого?;1;;0000b4a8a2--5e707f53dddbf7012599b2c0;0000b4a8a2--5e707d5a1fcfde011aac08ed;e42c279b9fe9ef53df9c39e986b9e6db;APPROVED;2020-03-17T07:42:11.543
Их родители умерли.;Родители баловали их.;Дети были отправлены в детдом.;Что стало причиной этого?;0;;0000b4a8a2--5e707f53dddbf7012599b2c0;0000b4a8a2--5e707d5a1fcfde011aac08ed;e42c279b9fe9ef53df9c39e986b9e6db;APPROVED;2020-03-17T07:42:11.543
Началось цунами.;Начался град.;Метеорит приземлился в океан.;Что случилось в результате?;0;;0000b4a8a2--5e707f53dddbf7012599b2c0;0000b4a8a2--5e707d5a1fcfde011aac08ed;e42c279b9fe9ef53df9c39e986b9e6db;APPROVED;2020-03-17T07:42:11.543
Мороженое потеряло аромат.;Мороженое стало таять.;Человек ел мороженое на солнце.;Что случилось в результате?;1;;0000b4a8a2--5e707f53f23b9201282c31a0;0000b4a8a2--5e707d5a1fcfde011aac08fc;80ed97a38c946a69ff1df85c454f2563;APPROVED;2020-03-17T07:42:11.006
Ковёр выглядел грязным.;Стены выглядели голыми.;Я повесил в комнате картину.;Что стало причиной этого?;1;;0000b4a8a2--5e707f53f23b9201282c31a0;0000b4a8a2--5e707d5a1fcfde011aac08fc;80ed97a38c946a69ff1df85c454f2563;APPROVED;2020-03-17T07:42:11.006
У меня болела голова.;Мой босс назначил совещание.;Я ушел с работы пораньше.;Что стало причиной этого?;0;;0000b4a8a2--5e707f53f23b9201282c31a0;0000b4a8a2--5e707d5a1fcfde011aac08fc;80ed97a38c946a69ff1df85c454f2563;APPROVED;2020-03-17T07:42:11.006
Хозяин отругал щенка.;Хозяин дал щенку лакомство.;Щенок испачкал ковёр.;Что случилось в результате?;0;;0000b4a8a2--5e707f53f23b9201282c31a0;0000b4a8a2--5e707d5a1fcfde011aac08fc;80ed97a38c946a69ff1df85c454f2563;APPROVED;2020-03-17T07:42:11.006
Подруга простила меня.;Подруга рассвирепела.;Я извинился перед моей подругой.;Что случилось в результате?;0;;0000b4a8a2--5e707f53f23b9201282c31a0;0000b4a8a2--5e707d5a1fcfde011aac08fc;80ed97a38c946a69ff1df85c454f2563;APPROVED;2020-03-17T07:42:11.006
Я закрыл замок.;Замок расстегнулся.;Я ввёл свою комбинацию кодового замка.;Что случилось в результате?;1;;0000b4a8a2--5e707f540b45eb012696beb6;0000b4a8a2--5e707d5a1fcfde011aac0934;764d9649d47636b6eaead32f0c0a105e;APPROVED;2020-03-17T07:42:12.700
Отец передал своему сыну немного денег.;Отец взял сына за руку.;Толпа стала гуще.;Что случилось в результате?;1;;0000b4a8a2--5e707f540b45eb012696beb6;0000b4a8a2--5e707d5a1fcfde011aac0934;764d9649d47636b6eaead32f0c0a105e;APPROVED;2020-03-17T07:42:12.700
Я слепил из снега снежок.;Я разгребал снег с дороги.;Снег блокировал дороги.;Что случилось в результате?;1;;0000b4a8a2--5e707f540b45eb012696beb6;0000b4a8a2--5e707d5a1fcfde011aac0934;764d9649d47636b6eaead32f0c0a105e;APPROVED;2020-03-17T07:42:12.700
Байдарка достигла берега.;Байдарка натолкнулась на волну.;Байдарочники налегли на вёсла.;Что случилось в результате?;0;;0000b4a8a2--5e707f540b45eb012696beb6;0000b4a8a2--5e707d5a1fcfde011aac0934;764d9649d47636b6eaead32f0c0a105e;APPROVED;2020-03-17T07:42:12.700
Она отпустила руль.;Она врезалась в забор.;Девушка потеряла контроль над своим велосипедом.;Что случилось в результате?;1;;0000b4a8a2--5e707f540b45eb012696beb6;0000b4a8a2--5e707d5a1fcfde011aac0934;764d9649d47636b6eaead32f0c0a105e;APPROVED;2020-03-17T07:42:12.700
У неё был творческий кризис.;Она отредактировала проект.;Писательница пропустила все сроки представления проекта.;Что стало причиной этого?;0;;0000b4a8a2--5e707f549bef5601280ea682;0000b4a8a2--5e707d5a1fcfde011aac0920;87fcb2b46b9b310b26ac8fe4679e3992;APPROVED;2020-03-17T07:42:12.985
Я просил поговорить с супервайзером.;Я предоставил мой идентификационный номер.;Сотрудник повесил трубку.;Что стало причиной этого?;0;;0000b4a8a2--5e707f549bef5601280ea682;0000b4a8a2--5e707d5a1fcfde011aac0920;87fcb2b46b9b310b26ac8fe4679e3992;APPROVED;2020-03-17T07:42:12.985
Раздался звонок в дверь.;Шторы закачались.;Ветер подул через открытое окно.;Что случилось в результате?;1;;0000b4a8a2--5e707f549bef5601280ea682;0000b4a8a2--5e707d5a1fcfde011aac0920;87fcb2b46b9b310b26ac8fe4679e3992;APPROVED;2020-03-17T07:42:12.985
Я вытащил вилку лампы из розетки.;Я пережёг предохранитель.;Электричество в моём доме отключилось.;Что стало причиной этого?;1;;0000b4a8a2--5e707f549bef5601280ea682;0000b4a8a2--5e707d5a1fcfde011aac0920;87fcb2b46b9b310b26ac8fe4679e3992;APPROVED;2020-03-17T07:42:12.985
Он размял свои мышцы перед зеркалом.;Он поднял штангу над головой.;Тяжелоатлет крякнул.;Что стало причиной этого?;1;;0000b4a8a2--5e707f549bef5601280ea682;0000b4a8a2--5e707d5a1fcfde011aac0920;87fcb2b46b9b310b26ac8fe4679e3992;APPROVED;2020-03-17T07:42:12.985
Молодые объявили, что они расходятся.;Молодые объявили, что у них будет ребёнок.;Семья поздравила молодых.;Что стало причиной этого?;1;;0000b4a8a2--5e707f54aa2c2f24e8fcfba0;0000b4a8a2--5e707d5a1fcfde011aac08f4;a6d0503c0debd14a87d78169d2fd11d3;APPROVED;2020-03-17T07:42:12.918
Он ей нравился.;Она поцеловала его.;Девочка послала мальчику валентинку.;Что стало причиной этого?;0;;0000b4a8a2--5e707f54aa2c2f24e8fcfba0;0000b4a8a2--5e707d5a1fcfde011aac08f4;a6d0503c0debd14a87d78169d2fd11d3;APPROVED;2020-03-17T07:42:12.918
Я был смущен.;Я согласился с ним.;Я кивнул в ответ на слова моего друга.;Что стало причиной этого?;1;;0000b4a8a2--5e707f54aa2c2f24e8fcfba0;0000b4a8a2--5e707d5a1fcfde011aac08f4;a6d0503c0debd14a87d78169d2fd11d3;APPROVED;2020-03-17T07:42:12.918
Они хотели найти компромисс.;Они хотели принять справедливое решение.;Друзья подбросили монетку.;Что стало причиной этого?;0;;0000b4a8a2--5e707f54aa2c2f24e8fcfba0;0000b4a8a2--5e707d5a1fcfde011aac08f4;a6d0503c0debd14a87d78169d2fd11d3;APPROVED;2020-03-17T07:42:12.918
Мужчина выгрузил продукты в холодильник.;Мужчина вынул пиццу из духовки.;На кухне звякнул таймер.;Что случилось в результате?;1;;0000b4a8a2--5e707f54aa2c2f24e8fcfba0;0000b4a8a2--5e707d5a1fcfde011aac08f4;a6d0503c0debd14a87d78169d2fd11d3;APPROVED;2020-03-17T07:42:12.918
Грязь прилипла к его ботинкам.;Грязь попала ему в лицо.;Мальчик шагнул в грязь.;Что случилось в результате?;0;;0000b4a8a2--5e707f54d44ef1012bc13825;0000b4a8a2--5e707d5a1fcfde011aac08f5;5d7b893ce116e6e8adaafdc13510ecb5;APPROVED;2020-03-17T07:42:12.023
Школы закрыли.;Люди попрятались в подполье.;В городе выпало несколько дюймов снега.;Что случилось в результате?;0;;0000b4a8a2--5e707f54d44ef1012bc13825;0000b4a8a2--5e707d5a1fcfde011aac08f5;5d7b893ce116e6e8adaafdc13510ecb5;APPROVED;2020-03-17T07:42:12.023
Он ушёл домой на выходной.;Он грозился бросить работу.;Смена работника закончилась.;Что случилось в результате?;0;;0000b4a8a2--5e707f54d44ef1012bc13825;0000b4a8a2--5e707d5a1fcfde011aac08f5;5d7b893ce116e6e8adaafdc13510ecb5;APPROVED;2020-03-17T07:42:12.023
Дерево упало на крышу.;Дерево затенило задний двор.;Дерево повредило дом.;Что стало причиной этого?;0;;0000b4a8a2--5e707f54d44ef1012bc13825;0000b4a8a2--5e707d5a1fcfde011aac08f5;5d7b893ce116e6e8adaafdc13510ecb5;APPROVED;2020-03-17T07:42:12.023
Я сложил дрова в камине.;Я с размаху ударил по полену топором.;Полено раскололось пополам.;Что стало причиной этого?;1;;0000b4a8a2--5e707f54d44ef1012bc13825;0000b4a8a2--5e707d5a1fcfde011aac08f5;5d7b893ce116e6e8adaafdc13510ecb5;APPROVED;2020-03-17T07:42:12.023
Он прогулял экзамен.;Он сдал экзамен.;Мальчик учился всю ночь.;Что случилось в результате?;1;;0000b4a8a2--5e707f552f3cb80124e51d04;0000b4a8a2--5e707d5a1fcfde011aac08e7;225538c3efba9a65820de451b7a14c7e;APPROVED;2020-03-17T07:42:13.168
Он боялся учиться плавать.;Спасатель был на дежурстве.;Мальчик уцепился за край бассейна.;Что стало причиной этого?;0;;0000b4a8a2--5e707f552f3cb80124e51d04;0000b4a8a2--5e707d5a1fcfde011aac08e7;225538c3efba9a65820de451b7a14c7e;APPROVED;2020-03-17T07:42:13.168
Я почувствовал своё сердцебиение.;Мой пульс ускорился.;Я положил руку себе на грудь.;Что случилось в результате?;0;;0000b4a8a2--5e707f552f3cb80124e51d04;0000b4a8a2--5e707d5a1fcfde011aac08e7;225538c3efba9a65820de451b7a14c7e;APPROVED;2020-03-17T07:42:13.168
Мой офис переполнен.;В моём кабинете шумно.;Здание, прилегающее к моему офису, ещё только строится.;Что случилось в результате?;1;;0000b4a8a2--5e707f552f3cb80124e51d04;0000b4a8a2--5e707d5a1fcfde011aac08e7;225538c3efba9a65820de451b7a14c7e;APPROVED;2020-03-17T07:42:13.168
Семья пригласила соседей на ужин.;Семья махнула помахала соседям с крыльца.;Семья захотела поближе узнать новых соседей.;Что случилось в результате?;0;;0000b4a8a2--5e707f552f3cb80124e51d04;0000b4a8a2--5e707d5a1fcfde011aac08e7;225538c3efba9a65820de451b7a14c7e;APPROVED;2020-03-17T07:42:13.168
Я спала весь день.;Я училась весь день.;Я чувствовала себя обессиленной.;Что стало причиной этого?;1;;0000b4a8a2--5e707f55711b9c012c85fb48;0000b4a8a2--5e707d5a1fcfde011aac0901;7cdacd8643c0c82abf674591eaab01be;APPROVED;2020-03-17T07:42:13.529
Она определила симптомы пациента.;Она прописала таблетки для пациента.;Врач поставила пациенту диагноз.;Что стало причиной этого?;0;;0000b4a8a2--5e707f55711b9c012c85fb48;0000b4a8a2--5e707d5a1fcfde011aac0901;7cdacd8643c0c82abf674591eaab01be;APPROVED;2020-03-17T07:42:13.529
Он была потной.;Она зудела.;Я расчесал кожу.;Что стало причиной этого?;1;;0000b4a8a2--5e707f55711b9c012c85fb48;0000b4a8a2--5e707d5a1fcfde011aac0901;7cdacd8643c0c82abf674591eaab01be;APPROVED;2020-03-17T07:42:13.529
Он потерял уверенность в себе.;Он перенёс сердечный приступ.;Мужчине сделали экстренную операцию.;Что стало причиной этого?;1;;0000b4a8a2--5e707f55711b9c012c85fb48;0000b4a8a2--5e707d5a1fcfde011aac0901;7cdacd8643c0c82abf674591eaab01be;APPROVED;2020-03-17T07:42:13.529
Он напряг руки.;Он потирал руки.;Мышцы его рук вздулись.;Что стало причиной этого?;0;;0000b4a8a2--5e707f55711b9c012c85fb48;0000b4a8a2--5e707d5a1fcfde011aac0901;7cdacd8643c0c82abf674591eaab01be;APPROVED;2020-03-17T07:42:13.529
Пчела ужалила садовника.;Белки выкопали луковицы.;Нарциссы в саду погибли.;Что стало причиной этого?;1;;0000b4a8a2--5e707f55e7c910012950974d;0000b4a8a2--5e707d5a1fcfde011aac08ed;752af47e67858b4e4ee3a2f2cdd2a929;APPROVED;2020-03-17T07:42:13.080
Пламя погасло.;На кончике спички появилось пламя.;Я чиркнул спичкой.;Что случилось в результате?;1;;0000b4a8a2--5e707f55e7c910012950974d;0000b4a8a2--5e707d5a1fcfde011aac08ed;752af47e67858b4e4ee3a2f2cdd2a929;APPROVED;2020-03-17T07:42:13.080
Они не хотели решать спор в суде.;Они хотели восстановить свои личные взаимоотношения.;Спорящие стороны достигли соглашения.;Что стало причиной этого?;0;;0000b4a8a2--5e707f55e7c910012950974d;0000b4a8a2--5e707d5a1fcfde011aac08ed;752af47e67858b4e4ee3a2f2cdd2a929;APPROVED;2020-03-17T07:42:13.080
Их родители умерли.;Родители баловали их.;Дети были отправлены в детдом.;Что стало причиной этого?;0;;0000b4a8a2--5e707f55e7c910012950974d;0000b4a8a2--5e707d5a1fcfde011aac08ed;752af47e67858b4e4ee3a2f2cdd2a929;APPROVED;2020-03-17T07:42:13.080
Началось цунами.;Начался град.;Метеорит приземлился в океан.;Что случилось в результате?;0;;0000b4a8a2--5e707f55e7c910012950974d;0000b4a8a2--5e707d5a1fcfde011aac08ed;752af47e67858b4e4ee3a2f2cdd2a929;APPROVED;2020-03-17T07:42:13.080
В принтере заканчиваются чернила.;В принтере закончилась бумага.;Документ напечатан неразборчиво.;Что стало причиной этого?;0;;0000b4a8a2--5e707f56711b9c012c85fb54;0000b4a8a2--5e707d5a1fcfde011aac08f7;f30c634557aa6e39b048946a43f90c69;APPROVED;2020-03-17T07:42:14.690
Болельщики равнялись на флаг.;Болельщики бросились на поле.;На стадионе играл гимн.;Что случилось в результате?;0;;0000b4a8a2--5e707f56711b9c012c85fb54;0000b4a8a2--5e707d5a1fcfde011aac08f7;f30c634557aa6e39b048946a43f90c69;APPROVED;2020-03-17T07:42:14.690
Я подал его на стол.;Я добавил в него соли.;Соус был пресный.;Что случилось в результате?;1;;0000b4a8a2--5e707f56711b9c012c85fb54;0000b4a8a2--5e707d5a1fcfde011aac08f7;f30c634557aa6e39b048946a43f90c69;APPROVED;2020-03-17T07:42:14.690
Полотенце впитало жидкость.;Разлитая жидкость оставила липкие следы.;Я стал собирать разлитую жидкость бумажным полотенцем.;Что случилось в результате?;0;;0000b4a8a2--5e707f56711b9c012c85fb54;0000b4a8a2--5e707d5a1fcfde011aac08f7;f30c634557aa6e39b048946a43f90c69;APPROVED;2020-03-17T07:42:14.690
Она заложила нужную страницу.;Она перечитала книгу.;Женщину прервали, когда она читала книгу.;Что случилось в результате?;0;;0000b4a8a2--5e707f56711b9c012c85fb54;0000b4a8a2--5e707d5a1fcfde011aac08f7;f30c634557aa6e39b048946a43f90c69;APPROVED;2020-03-17T07:42:14.690
Я опустился на колени посреди поля.;Я завернулся в одеяло.;Я чувствовал себя комфортно.;Что стало причиной этого?;1;;0000b4a8a2--5e707f56942cf60126623989;0000b4a8a2--5e707d5a1fcfde011aac0914;b8cb36b236e37e3280bf349baa230d41;APPROVED;2020-03-17T07:42:14.130
Он стал скользким.;Он стал блестящим.;Я полировал камень.;Что случилось в результате?;1;;0000b4a8a2--5e707f56942cf60126623989;0000b4a8a2--5e707d5a1fcfde011aac0914;b8cb36b236e37e3280bf349baa230d41;APPROVED;2020-03-17T07:42:14.130
Кофе сильно пах.;Кофе стал сладким.;Я добавил сахар в кофе.;Что случилось в результате?;1;;0000b4a8a2--5e707f56942cf60126623989;0000b4a8a2--5e707d5a1fcfde011aac0914;b8cb36b236e37e3280bf349baa230d41;APPROVED;2020-03-17T07:42:14.130
Он порезался бумагой.;Он уничтожил документы.;Мужчина пролистал документы.;Что случилось в результате?;0;;0000b4a8a2--5e707f56942cf60126623989;0000b4a8a2--5e707d5a1fcfde011aac0914;b8cb36b236e37e3280bf349baa230d41;APPROVED;2020-03-17T07:42:14.130
Гвоздь вонзился в дерево.;Гвоздь заржавел.;Я забивал гвоздь.;Что случилось в результате?;0;;0000b4a8a2--5e707f56942cf60126623989;0000b4a8a2--5e707d5a1fcfde011aac0914;b8cb36b236e37e3280bf349baa230d41;APPROVED;2020-03-17T07:42:14.130
Всю ночь лил дождь.;Он весь зарос сорняками.;Газон был грязный.;Что стало причиной этого?;0;;0000b4a8a2--5e707f56aedc8301261cbbb5;0000b4a8a2--5e707d5a1fcfde011aac0935;0911cb7c42db62f52ac88826222101fc;APPROVED;2020-03-17T07:42:14.667
Она осталась ночевать в гостинице.;Она забыла завести будильник.;Женщина проспала.;Что стало причиной этого?;1;;0000b4a8a2--5e707f56aedc8301261cbbb5;0000b4a8a2--5e707d5a1fcfde011aac0935;0911cb7c42db62f52ac88826222101fc;APPROVED;2020-03-17T07:42:14.667
Он сидел в тени.;Он пошёл на пляж.;Мужчина нанёс на кожу солнцезащитный крем.;Что стало причиной этого?;1;;0000b4a8a2--5e707f56aedc8301261cbbb5;0000b4a8a2--5e707d5a1fcfde011aac0935;0911cb7c42db62f52ac88826222101fc;APPROVED;2020-03-17T07:42:14.667
Исследователи отказались от теории.;Люди приняли теорию.;Исследователи доказали теорию.;Что случилось в результате?;1;;0000b4a8a2--5e707f56aedc8301261cbbb5;0000b4a8a2--5e707d5a1fcfde011aac0935;0911cb7c42db62f52ac88826222101fc;APPROVED;2020-03-17T07:42:14.667
Игра перешла в овертайм.;Судья принял неверное решение.;Болельщики на матче недовольно свистели.;Что стало причиной этого?;1;;0000b4a8a2--5e707f56aedc8301261cbbb5;0000b4a8a2--5e707d5a1fcfde011aac0935;0911cb7c42db62f52ac88826222101fc;APPROVED;2020-03-17T07:42:14.667
Прутик сгорел.;Огонь погас.;Девушка бросила прутик в костер.;Что случилось в результате?;0;;0000b4a8a2--5e707f56c83df801277af31d;0000b4a8a2--5e707d5a1fcfde011aac08e2;216bfa31bcc8a29c6ad083ab335386ff;APPROVED;2020-03-17T07:42:14.642
Горячей воды не было.;Он не мог найти полотенце.;Мужчина вышел из душа.;Что стало причиной этого?;1;;0000b4a8a2--5e707f56c83df801277af31d;0000b4a8a2--5e707d5a1fcfde011aac08e2;216bfa31bcc8a29c6ad083ab335386ff;APPROVED;2020-03-17T07:42:14.642
Они будут откладывать в накопительный фонд для обучения.;Они поощряют своих детей играть на улице.;Родители хотят, чтобы их дети ходили в колледж.;Что случилось в результате?;0;;0000b4a8a2--5e707f56c83df801277af31d;0000b4a8a2--5e707d5a1fcfde011aac08e2;216bfa31bcc8a29c6ad083ab335386ff;APPROVED;2020-03-17T07:42:14.642
Ботинки стали посвободнее.;Ботинки стали ношеными.;Мужчина расшнуровал ботинки.;Что случилось в результате?;0;;0000b4a8a2--5e707f56c83df801277af31d;0000b4a8a2--5e707d5a1fcfde011aac08e2;216bfa31bcc8a29c6ad083ab335386ff;APPROVED;2020-03-17T07:42:14.642
Он заморозил остатки.;Он сохранил рецепт.;Мужчина съел половину блюда.;Что случилось в результате?;0;;0000b4a8a2--5e707f56c83df801277af31d;0000b4a8a2--5e707d5a1fcfde011aac08e2;216bfa31bcc8a29c6ad083ab335386ff;APPROVED;2020-03-17T07:42:14.642
Он обнаружил крыс в подвале.;Он держал муравьиную ферму в своей комнате.;Домовладелец пригласил в дом дезинсектора.;Что стало причиной этого?;0;;0000b4a8a2--5e707f5705a5060126babf56;0000b4a8a2--5e707d5a1fcfde011aac08ff;6827eb7a46422aa28b9273b23ac61f15;APPROVED;2020-03-17T07:42:15.479
Я слишком устал, чтобы что-нибудь приготовить.;Моя гостья слишком засиделась у меня.;Я предложил моей гостье поужинать вне дома.;Что стало причиной этого?;0;;0000b4a8a2--5e707f5705a5060126babf56;0000b4a8a2--5e707d5a1fcfde011aac08ff;6827eb7a46422aa28b9273b23ac61f15;APPROVED;2020-03-17T07:42:15.479
