INPUT:sent1;INPUT:sent2;INPUT:premise;INPUT:question;OUTPUT:variant;HINT:text;ASSIGNMENT:assignment_id;ASSIGNMENT:task_suite_id;ASSIGNMENT:worker_id;ASSIGNMENT:status;ASSIGNMENT:started
Страна отмечает свою независимость.;Страна сталкивается с экономическими трудностями.;Граждане вывесили национальные флаги на наружные стены домов.;Что стало причиной этого?;0;;0000b4a8a2--5e707f6f9ca47b01255fee4f;0000b4a8a2--5e707d5a1fcfde011aac0929;e66404e39820fee911c40751b2bd96db;APPROVED;2020-03-17T07:42:39.805
Они разочаровали своих болельщиков.;Они вдохновили своих болельщиков.;Команда проиграла турнир.;Что случилось в результате?;0;;0000b4a8a2--5e707f6f9ca47b01255fee4f;0000b4a8a2--5e707d5a1fcfde011aac0929;e66404e39820fee911c40751b2bd96db;APPROVED;2020-03-17T07:42:39.805
Я почувствовал себя неловко.;Я почувствовал гордость.;Мой друг сказал, что у меня еда застряла в зубах.;Что случилось в результате?;0;;0000b4a8a2--5e707f6f9ca47b01255fee4f;0000b4a8a2--5e707d5a1fcfde011aac0929;e66404e39820fee911c40751b2bd96db;APPROVED;2020-03-17T07:42:39.805
У него был скромный заработок.;Он получал зарплату меньше минимального размера оплаты труда.;Его семья жила в нищете.;Что стало причиной этого?;1;;0000b4a8a2--5e707f6fc295960123133ecf;0000b4a8a2--5e707d5a1fcfde011aac0907;b8cb36b236e37e3280bf349baa230d41;APPROVED;2020-03-17T07:42:39.730
Он искал работу.;Он нашёл хобби.;Студент окончил университет.;Что случилось в результате?;0;;0000b4a8a2--5e707f6fc295960123133ecf;0000b4a8a2--5e707d5a1fcfde011aac0907;b8cb36b236e37e3280bf349baa230d41;APPROVED;2020-03-17T07:42:39.730
Краска забрызгала всё вокруг.;Краска позеленела.;Художник смешал желтую краску с синей.;Что случилось в результате?;1;;0000b4a8a2--5e707f6fc295960123133ecf;0000b4a8a2--5e707d5a1fcfde011aac0907;b8cb36b236e37e3280bf349baa230d41;APPROVED;2020-03-17T07:42:39.730
У меня кончились темы для разговора.;Разговор становился напряженным.;Я сменила тему разговора.;Что стало причиной этого?;1;;0000b4a8a2--5e707f6fc295960123133ecf;0000b4a8a2--5e707d5a1fcfde011aac0907;b8cb36b236e37e3280bf349baa230d41;APPROVED;2020-03-17T07:42:39.730
Я приветствовал его дома.;Я оказал ему холодный прием.;Моего брата выписали из больницы.;Что случилось в результате?;0;;0000b4a8a2--5e707f6fc295960123133ecf;0000b4a8a2--5e707d5a1fcfde011aac0907;b8cb36b236e37e3280bf349baa230d41;APPROVED;2020-03-17T07:42:39.730
Доказательства были против него.;Никаких доказательств против него не было.;Преступник сдался.;Что стало причиной этого?;0;;0000b4a8a2--5e707f6fc295960123133ed3;0000b4a8a2--5e707d5a1fcfde011aac091d;27fb72f040dc791b7a4effc5e33e710b;APPROVED;2020-03-17T07:42:39.766
Он отказался от сладостей.;Он избегал кофеина.;Грузный мужчина решил похудеть.;Что случилось в результате?;0;;0000b4a8a2--5e707f6fc295960123133ed3;0000b4a8a2--5e707d5a1fcfde011aac091d;27fb72f040dc791b7a4effc5e33e710b;APPROVED;2020-03-17T07:42:39.766
Она поскользнулась.;Она поёжилась.;Девушка ступила на лед.;Что случилось в результате?;0;;0000b4a8a2--5e707f6fc295960123133ed3;0000b4a8a2--5e707d5a1fcfde011aac091d;27fb72f040dc791b7a4effc5e33e710b;APPROVED;2020-03-17T07:42:39.766
Она не спала всю ночь.;Она положила сына на кровать.;У женщины полукружья под глазами.;Что стало причиной этого?;0;;0000b4a8a2--5e707f6fc295960123133ed3;0000b4a8a2--5e707d5a1fcfde011aac091d;27fb72f040dc791b7a4effc5e33e710b;APPROVED;2020-03-17T07:42:39.766
Вулкан проснулся.;Вулкан был спящим.;Лава хлынула из вулкана.;Что стало причиной этого?;0;;0000b4a8a2--5e707f6fc295960123133ed3;0000b4a8a2--5e707d5a1fcfde011aac091d;27fb72f040dc791b7a4effc5e33e710b;APPROVED;2020-03-17T07:42:39.766
Он отращивал волосы.;Его волосы стали слишком длинными.;Человек пошёл к парикмахеру.;Что стало причиной этого?;1;;0000b4a8a2--5e707f701b254f012a7aee1b;0000b4a8a2--5e707d5a1fcfde011aac0921;7a903313bd37598709a4cf867083627d;APPROVED;2020-03-17T07:42:40.464
Мальчик приветствовал нового одноклассника.;Мальчик невзлюбил новенького.;Мальчик сыграл злую шутку над своим новым одноклассником.;Что стало причиной этого?;1;;0000b4a8a2--5e707f701b254f012a7aee1b;0000b4a8a2--5e707d5a1fcfde011aac0921;7a903313bd37598709a4cf867083627d;APPROVED;2020-03-17T07:42:40.464
Я ел печенье.;Я пёк хлеб.;Я очень хотел стакан молока.;Что стало причиной этого?;0;;0000b4a8a2--5e707f701b254f012a7aee1b;0000b4a8a2--5e707d5a1fcfde011aac0921;7a903313bd37598709a4cf867083627d;APPROVED;2020-03-17T07:42:40.464
Водитель включил фары.;Водитель пустил машину задним ходом.;Начался дождь.;Что случилось в результате?;0;;0000b4a8a2--5e707f701b254f012a7aee1b;0000b4a8a2--5e707d5a1fcfde011aac0921;7a903313bd37598709a4cf867083627d;APPROVED;2020-03-17T07:42:40.464
Я припарковался через дорогу.;Я припарковался возле входа.;На стоянке у здания было пусто.;Что случилось в результате?;1;;0000b4a8a2--5e707f701b254f012a7aee1b;0000b4a8a2--5e707d5a1fcfde011aac0921;7a903313bd37598709a4cf867083627d;APPROVED;2020-03-17T07:42:40.464
Она пошла на ферму.;Она пошла в супермаркет.;У женщины закончились яйца.;Что случилось в результате?;1;;0000b4a8a2--5e707f70a21939012750122e;0000b4a8a2--5e707d5a1fcfde011aac0923;3d912959dc0e78548eb548561b3677f8;APPROVED;2020-03-17T07:42:40.761
Я раскрыл ему секрет.;Я крепко обнял его.;Я встретил старого друга.;Что случилось в результате?;1;;0000b4a8a2--5e707f70a21939012750122e;0000b4a8a2--5e707d5a1fcfde011aac0923;3d912959dc0e78548eb548561b3677f8;APPROVED;2020-03-17T07:42:40.761
Она поймала рыбу.;Оно выглядело грязным.;Женщина избегала заходить в озеро.;Что стало причиной этого?;1;;0000b4a8a2--5e707f70a21939012750122e;0000b4a8a2--5e707d5a1fcfde011aac0923;3d912959dc0e78548eb548561b3677f8;APPROVED;2020-03-17T07:42:40.761
Его зонт был сломан.;Его велосипед был украден.;Студент прибыл на занятие мокрым.;Что стало причиной этого?;0;;0000b4a8a2--5e707f70a21939012750122e;0000b4a8a2--5e707d5a1fcfde011aac0923;3d912959dc0e78548eb548561b3677f8;APPROVED;2020-03-17T07:42:40.761
Пользователь щёлкнул мышкой.;Пользователь сдвинул мышь.;Курсор на экране компьютера перемещается.;Что стало причиной этого?;1;;0000b4a8a2--5e707f70a21939012750122e;0000b4a8a2--5e707d5a1fcfde011aac0923;3d912959dc0e78548eb548561b3677f8;APPROVED;2020-03-17T07:42:40.761
Ветер стал сильнее.;Поджигатели были задержаны.;Лесной пожар распространялся.;Что стало причиной этого?;0;;0000b4a8a2--5e707f70aedc8301261cbccc;0000b4a8a2--5e707d5a1fcfde011aac0902;af044d753a9aa9de414874192aaa5e24;APPROVED;2020-03-17T07:42:40.514
Мать отправила его в комнату.;Мать наложила на рану повязку.;Ребенок ободрал колено.;Что случилось в результате?;1;;0000b4a8a2--5e707f70aedc8301261cbccc;0000b4a8a2--5e707d5a1fcfde011aac0902;af044d753a9aa9de414874192aaa5e24;APPROVED;2020-03-17T07:42:40.514
Он написал завещание.;Ему сделали пересадку органов.;Человек выжил после смертельной болезни.;Что стало причиной этого?;1;;0000b4a8a2--5e707f70aedc8301261cbccc;0000b4a8a2--5e707d5a1fcfde011aac0902;af044d753a9aa9de414874192aaa5e24;APPROVED;2020-03-17T07:42:40.514
Я прикусил язык.;Я обжёг язык.;Я отхлебнул горячего кофе.;Что случилось в результате?;1;;0000b4a8a2--5e707f70aedc8301261cbccc;0000b4a8a2--5e707d5a1fcfde011aac0902;af044d753a9aa9de414874192aaa5e24;APPROVED;2020-03-17T07:42:40.514
Писатель избегал предвзятости в тексте.;Писатель пропустил важный дедлайн.;Редактор уволил писателя.;Что стало причиной этого?;1;;0000b4a8a2--5e707f70aedc8301261cbccc;0000b4a8a2--5e707d5a1fcfde011aac0902;af044d753a9aa9de414874192aaa5e24;APPROVED;2020-03-17T07:42:40.514
Пара переехала в квартиру.;Город признал квартиру непригодной.;Пара подписала договор аренды на квартиру.;Что случилось в результате?;0;;0000b4a8a2--5e707f70f23b9201282c3263;0000b4a8a2--5e707d5a1fcfde011aac0936;1961509830f2b997ad074828d21cb742;APPROVED;2020-03-17T07:42:40.053
Она хотела посмотреть на закат.;Ей показалось, что она видела молнию.;Женщина сидела снаружи на крыльце.;Что стало причиной этого?;0;;0000b4a8a2--5e707f70f23b9201282c3263;0000b4a8a2--5e707d5a1fcfde011aac0936;1961509830f2b997ad074828d21cb742;APPROVED;2020-03-17T07:42:40.053
Он не умел плавать.;Вода была неглубокой.;В воде был мужчина, одетый в спасательный жилет.;Что стало причиной этого?;0;;0000b4a8a2--5e707f70f23b9201282c3263;0000b4a8a2--5e707d5a1fcfde011aac0936;1961509830f2b997ad074828d21cb742;APPROVED;2020-03-17T07:42:40.053
Она удалила документ.;Она нажала клавишу Backspace.;Женщина сделала опечатку в текстовом процессоре.;Что случилось в результате?;1;;0000b4a8a2--5e707f70f23b9201282c3263;0000b4a8a2--5e707d5a1fcfde011aac0936;1961509830f2b997ad074828d21cb742;APPROVED;2020-03-17T07:42:40.053
Она получила плохую оценку.;Она выиграла конкурс.;Девушка хвасталась подругам.;Что стало причиной этого?;1;;0000b4a8a2--5e707f70f23b9201282c3263;0000b4a8a2--5e707d5a1fcfde011aac0936;1961509830f2b997ad074828d21cb742;APPROVED;2020-03-17T07:42:40.053
Ветер стал сильнее.;Поджигатели были задержаны.;Лесной пожар распространялся.;Что стало причиной этого?;0;;0000b4a8a2--5e707f71498ab0012c032577;0000b4a8a2--5e707d5a1fcfde011aac0902;4b871bdbf30c897e6bb9d636afc04b98;APPROVED;2020-03-17T07:42:41.597
Мать отправила его в комнату.;Мать наложила на рану повязку.;Ребенок ободрал колено.;Что случилось в результате?;1;;0000b4a8a2--5e707f71498ab0012c032577;0000b4a8a2--5e707d5a1fcfde011aac0902;4b871bdbf30c897e6bb9d636afc04b98;APPROVED;2020-03-17T07:42:41.597
Он написал завещание.;Ему сделали пересадку органов.;Человек выжил после смертельной болезни.;Что стало причиной этого?;1;;0000b4a8a2--5e707f71498ab0012c032577;0000b4a8a2--5e707d5a1fcfde011aac0902;4b871bdbf30c897e6bb9d636afc04b98;APPROVED;2020-03-17T07:42:41.597
Я прикусил язык.;Я обжёг язык.;Я отхлебнул горячего кофе.;Что случилось в результате?;1;;0000b4a8a2--5e707f71498ab0012c032577;0000b4a8a2--5e707d5a1fcfde011aac0902;4b871bdbf30c897e6bb9d636afc04b98;APPROVED;2020-03-17T07:42:41.597
Писатель избегал предвзятости в тексте.;Писатель пропустил важный дедлайн.;Редактор уволил писателя.;Что стало причиной этого?;1;;0000b4a8a2--5e707f71498ab0012c032577;0000b4a8a2--5e707d5a1fcfde011aac0902;4b871bdbf30c897e6bb9d636afc04b98;APPROVED;2020-03-17T07:42:41.597
Он был удивлён.;Он был обескуражен.;Мужчина поднял брови.;Что стало причиной этого?;0;;0000b4a8a2--5e707f71498ab0012c032583;0000b4a8a2--5e707d5a1fcfde011aac0900;6db6905fd3ed40aeeddc9fe6990058f7;APPROVED;2020-03-17T07:42:41.780
Я считал, что у него были добрые намерения.;Я полагал, что ему лучше знать.;Я простил коллеге его просчёт.;Что стало причиной этого?;0;;0000b4a8a2--5e707f71498ab0012c032583;0000b4a8a2--5e707d5a1fcfde011aac0900;6db6905fd3ed40aeeddc9fe6990058f7;APPROVED;2020-03-17T07:42:41.780
Он стал больше работать.;Он стал раньше вставать.;Человек бросил курить.;Что случилось в результате?;0;;0000b4a8a2--5e707f71498ab0012c032583;0000b4a8a2--5e707d5a1fcfde011aac0900;6db6905fd3ed40aeeddc9fe6990058f7;APPROVED;2020-03-17T07:42:41.780
Тело нападавшего казалось безжизненным.;У нападавшего пошла кровь.;Женщина ударила нападавшего по носу.;Что случилось в результате?;1;;0000b4a8a2--5e707f71498ab0012c032583;0000b4a8a2--5e707d5a1fcfde011aac0900;6db6905fd3ed40aeeddc9fe6990058f7;APPROVED;2020-03-17T07:42:41.780
У игрока не было задачи попасть в цель.;Мужчина проиграл.;Дротик не попал в яблочко.;Что стало причиной этого?;1;;0000b4a8a2--5e707f71498ab0012c032583;0000b4a8a2--5e707d5a1fcfde011aac0900;6db6905fd3ed40aeeddc9fe6990058f7;APPROVED;2020-03-17T07:42:41.780
Прутик сгорел.;Огонь погас.;Девушка бросила прутик в костер.;Что случилось в результате?;0;;0000b4a8a2--5e707f714c82190116b9a65f;0000b4a8a2--5e707d5a1fcfde011aac08e2;f2ca3d107543223122d74437faf968dd;APPROVED;2020-03-17T07:42:41.300
Горячей воды не было.;Он не мог найти полотенце.;Мужчина вышел из душа.;Что стало причиной этого?;0;;0000b4a8a2--5e707f714c82190116b9a65f;0000b4a8a2--5e707d5a1fcfde011aac08e2;f2ca3d107543223122d74437faf968dd;APPROVED;2020-03-17T07:42:41.300
Они будут откладывать в накопительный фонд для обучения.;Они поощряют своих детей играть на улице.;Родители хотят, чтобы их дети ходили в колледж.;Что случилось в результате?;0;;0000b4a8a2--5e707f714c82190116b9a65f;0000b4a8a2--5e707d5a1fcfde011aac08e2;f2ca3d107543223122d74437faf968dd;APPROVED;2020-03-17T07:42:41.300
Ботинки стали посвободнее.;Ботинки стали ношеными.;Мужчина расшнуровал ботинки.;Что случилось в результате?;0;;0000b4a8a2--5e707f714c82190116b9a65f;0000b4a8a2--5e707d5a1fcfde011aac08e2;f2ca3d107543223122d74437faf968dd;APPROVED;2020-03-17T07:42:41.300
Он заморозил остатки.;Он сохранил рецепт.;Мужчина съел половину блюда.;Что случилось в результате?;0;;0000b4a8a2--5e707f714c82190116b9a65f;0000b4a8a2--5e707d5a1fcfde011aac08e2;f2ca3d107543223122d74437faf968dd;APPROVED;2020-03-17T07:42:41.300
Он выбыл из гонки.;Он ускорил темп.;Бегун почувствовал, что соперник вот-вот обойдёт его.;Что случилось в результате?;1;;0000b4a8a2--5e707f718748990119991d26;0000b4a8a2--5e707d5a1fcfde011aac08e0;ea61247858e22495263572c0a5825a9c;APPROVED;2020-03-17T07:42:41.917
Я обратилась за советом.;Я придумала решение.;Я упорно думала о проблеме.;Что случилось в результате?;1;;0000b4a8a2--5e707f718748990119991d26;0000b4a8a2--5e707d5a1fcfde011aac08e0;ea61247858e22495263572c0a5825a9c;APPROVED;2020-03-17T07:42:41.917
Ему было страшно.;Он ощущал экстаз.;Путник шёл по шаткому подвесному мосту.;Что случилось в результате?;0;;0000b4a8a2--5e707f718748990119991d26;0000b4a8a2--5e707d5a1fcfde011aac08e0;ea61247858e22495263572c0a5825a9c;APPROVED;2020-03-17T07:42:41.917
Он встретился с друзьями, чтобы посмотреть игру.;Он заключил пари со своими друзьями.;Мужчина ждал, что его команда победит.;Что случилось в результате?;1;;0000b4a8a2--5e707f718748990119991d26;0000b4a8a2--5e707d5a1fcfde011aac08e0;ea61247858e22495263572c0a5825a9c;APPROVED;2020-03-17T07:42:41.917
Он завёл будильник.;Он считал овец.;Мальчик не мог заснуть.;Что случилось в результате?;1;;0000b4a8a2--5e707f718748990119991d26;0000b4a8a2--5e707d5a1fcfde011aac08e0;ea61247858e22495263572c0a5825a9c;APPROVED;2020-03-17T07:42:41.917
Сестра женщины сложила руки.;Сестра женщины начала плакать.;Женщина протянула сестре носовой платок.;Что стало причиной этого?;1;;0000b4a8a2--5e707f719ca47b01255fee62;0000b4a8a2--5e707d5a1fcfde011aac0926;e1a1de22ec5db981722d86dfec1945d2;APPROVED;2020-03-17T07:42:41.116
Его губы были потрескались.;Его беспокоит неприятный запах изо рта.;Мужчина взял себе мяты.;Что стало причиной этого?;1;;0000b4a8a2--5e707f719ca47b01255fee62;0000b4a8a2--5e707d5a1fcfde011aac0926;e1a1de22ec5db981722d86dfec1945d2;APPROVED;2020-03-17T07:42:41.116
Они ожидали, что вокруг театра будет много машин.;Они получили приглашения в театр.;Пара выехала на шоу заранее.;Что стало причиной этого?;0;;0000b4a8a2--5e707f719ca47b01255fee62;0000b4a8a2--5e707d5a1fcfde011aac0926;e1a1de22ec5db981722d86dfec1945d2;APPROVED;2020-03-17T07:42:41.116
Её босс хвалил её.;Её коллега прикрывал её.;Женщина осталась дома в рабочий день.;Что случилось в результате?;1;;0000b4a8a2--5e707f719ca47b01255fee62;0000b4a8a2--5e707d5a1fcfde011aac0926;e1a1de22ec5db981722d86dfec1945d2;APPROVED;2020-03-17T07:42:41.116
Он разделял их взгляды.;Он считал их сумасшедшими.;Человек подписал петицию активистов.;Что стало причиной этого?;0;;0000b4a8a2--5e707f719ca47b01255fee62;0000b4a8a2--5e707d5a1fcfde011aac0926;e1a1de22ec5db981722d86dfec1945d2;APPROVED;2020-03-17T07:42:41.116
Она пошла на ферму.;Она пошла в супермаркет.;У женщины закончились яйца.;Что случилось в результате?;1;;0000b4a8a2--5e707f71aa2c2f24e8fcfca0;0000b4a8a2--5e707d5a1fcfde011aac0923;80ed97a38c946a69ff1df85c454f2563;APPROVED;2020-03-17T07:42:41.192
Я раскрыл ему секрет.;Я крепко обнял его.;Я встретил старого друга.;Что случилось в результате?;1;;0000b4a8a2--5e707f71aa2c2f24e8fcfca0;0000b4a8a2--5e707d5a1fcfde011aac0923;80ed97a38c946a69ff1df85c454f2563;APPROVED;2020-03-17T07:42:41.192
Она поймала рыбу.;Оно выглядело грязным.;Женщина избегала заходить в озеро.;Что стало причиной этого?;1;;0000b4a8a2--5e707f71aa2c2f24e8fcfca0;0000b4a8a2--5e707d5a1fcfde011aac0923;80ed97a38c946a69ff1df85c454f2563;APPROVED;2020-03-17T07:42:41.192
Его зонт был сломан.;Его велосипед был украден.;Студент прибыл на занятие мокрым.;Что стало причиной этого?;0;;0000b4a8a2--5e707f71aa2c2f24e8fcfca0;0000b4a8a2--5e707d5a1fcfde011aac0923;80ed97a38c946a69ff1df85c454f2563;APPROVED;2020-03-17T07:42:41.192
Пользователь щёлкнул мышкой.;Пользователь сдвинул мышь.;Курсор на экране компьютера перемещается.;Что стало причиной этого?;1;;0000b4a8a2--5e707f71aa2c2f24e8fcfca0;0000b4a8a2--5e707d5a1fcfde011aac0923;80ed97a38c946a69ff1df85c454f2563;APPROVED;2020-03-17T07:42:41.192
Её соперник обвинил её в жульничестве.;Её противник почувствовал жалость к ней.;Участница игры выиграла пять матчей подряд.;Что случилось в результате?;0;;0000b4a8a2--5e707f71c295960123133ee3;0000b4a8a2--5e707d5a1fcfde011aac093e;3d88c76afcf2819d5ac1e5c1eed83f5c;APPROVED;2020-03-17T07:42:41.792
Он поймал студента на списывании.;Ответы студента были неправильными.;Учитель порвал экзаменационную работу студента.;Что стало причиной этого?;0;;0000b4a8a2--5e707f71c295960123133ee3;0000b4a8a2--5e707d5a1fcfde011aac093e;3d88c76afcf2819d5ac1e5c1eed83f5c;APPROVED;2020-03-17T07:42:41.792
Я потерял голос.;У меня перехватило дыхание.;Я сделал паузу, чтобы перестать говорить.;Что стало причиной этого?;1;;0000b4a8a2--5e707f71c295960123133ee3;0000b4a8a2--5e707d5a1fcfde011aac093e;3d88c76afcf2819d5ac1e5c1eed83f5c;APPROVED;2020-03-17T07:42:41.792
Я положил их в микроволновку.;Я накрыл их пластиковой пленкой.;Замороженные продукты оттаивают.;Что стало причиной этого?;0;;0000b4a8a2--5e707f71c295960123133ee3;0000b4a8a2--5e707d5a1fcfde011aac093e;3d88c76afcf2819d5ac1e5c1eed83f5c;APPROVED;2020-03-17T07:42:41.792
У него были спазмы в животе.;Он хотел выходной день.;Работник подделал больничный.;Что стало причиной этого?;1;;0000b4a8a2--5e707f71c295960123133ee3;0000b4a8a2--5e707d5a1fcfde011aac093e;3d88c76afcf2819d5ac1e5c1eed83f5c;APPROVED;2020-03-17T07:42:41.792
Пара переехала в квартиру.;Город признал квартиру непригодной.;Пара подписала договор аренды на квартиру.;Что случилось в результате?;0;;0000b4a8a2--5e707f73942cf60126623ae3;0000b4a8a2--5e707d5a1fcfde011aac0936;94592fb70b782fb3ed05b32c8a4e3f7c;APPROVED;2020-03-17T07:42:43.686
Она хотела посмотреть на закат.;Ей показалось, что она видела молнию.;Женщина сидела снаружи на крыльце.;Что стало причиной этого?;0;;0000b4a8a2--5e707f73942cf60126623ae3;0000b4a8a2--5e707d5a1fcfde011aac0936;94592fb70b782fb3ed05b32c8a4e3f7c;APPROVED;2020-03-17T07:42:43.686
Он не умел плавать.;Вода была неглубокой.;В воде был мужчина, одетый в спасательный жилет.;Что стало причиной этого?;0;;0000b4a8a2--5e707f73942cf60126623ae3;0000b4a8a2--5e707d5a1fcfde011aac0936;94592fb70b782fb3ed05b32c8a4e3f7c;APPROVED;2020-03-17T07:42:43.686
Она удалила документ.;Она нажала клавишу Backspace.;Женщина сделала опечатку в текстовом процессоре.;Что случилось в результате?;1;;0000b4a8a2--5e707f73942cf60126623ae3;0000b4a8a2--5e707d5a1fcfde011aac0936;94592fb70b782fb3ed05b32c8a4e3f7c;APPROVED;2020-03-17T07:42:43.686
