INPUT:sent1;INPUT:sent2;INPUT:premise;INPUT:question;OUTPUT:variant;HINT:text;ASSIGNMENT:assignment_id;ASSIGNMENT:task_suite_id;ASSIGNMENT:worker_id;ASSIGNMENT:status;ASSIGNMENT:started
У него была галлюцинация.;У него была медитация.;Мужчина видел пришельцев.;Что стало причиной этого?;0;;0000b4a8a2--5e707f28c4749501278d3b90;0000b4a8a2--5e707d5a1fcfde011aac0931;87fcb2b46b9b310b26ac8fe4679e3992;APPROVED;2020-03-17T07:41:28.877
Он отбеливал их.;Он мыл их шампунем.;Волосы человека стали светлее.;Что стало причиной этого?;0;;0000b4a8a2--5e707f28c4749501278d3b90;0000b4a8a2--5e707d5a1fcfde011aac0931;87fcb2b46b9b310b26ac8fe4679e3992;APPROVED;2020-03-17T07:41:28.877
Она критиковал свои предыдущие работы.;Она ощутила прилив вдохновения.;Художница создала новую работу.;Что стало причиной этого?;1;;0000b4a8a2--5e707f28c4749501278d3b90;0000b4a8a2--5e707d5a1fcfde011aac0931;87fcb2b46b9b310b26ac8fe4679e3992;APPROVED;2020-03-17T07:41:28.877
Она пошла в библиотеку.;Она смотрела на звезды.;Девушка хотела узнать о Солнечной системе.;Что случилось в результате?;0;;0000b4a8a2--5e707f29aedc8301261cb8e6;0000b4a8a2--5e707d5a1fcfde011aac090d;d8cea79050419507969cb3791c4ff027;APPROVED;2020-03-17T07:41:29.884
Я расположил плакат над дверью.;Я прилепил клейкую ленту к задней части плаката.;Плакат приклеился к стене.;Что стало причиной этого?;1;;0000b4a8a2--5e707f29aedc8301261cb8e6;0000b4a8a2--5e707d5a1fcfde011aac090d;d8cea79050419507969cb3791c4ff027;APPROVED;2020-03-17T07:41:29.884
Архитектор построил здание.;Архитектор скорректировал план.;Клиент утвердил архитектору план строительства.;Что случилось в результате?;1;;0000b4a8a2--5e707f29aedc8301261cb8e6;0000b4a8a2--5e707d5a1fcfde011aac090d;d8cea79050419507969cb3791c4ff027;APPROVED;2020-03-17T07:41:29.884
Его рука дрожала.;Он облизал ложку.;Мужчина отложил свою ложку.;Что стало причиной этого?;1;;0000b4a8a2--5e707f29aedc8301261cb8e6;0000b4a8a2--5e707d5a1fcfde011aac090d;d8cea79050419507969cb3791c4ff027;APPROVED;2020-03-17T07:41:29.884
Совет директоров компании был распущен.;Совет директоров нашёл ему замену.;Генеральный директор компании подал в отставку.;Что случилось в результате?;0;;0000b4a8a2--5e707f29aedc8301261cb8e6;0000b4a8a2--5e707d5a1fcfde011aac090d;d8cea79050419507969cb3791c4ff027;APPROVED;2020-03-17T07:41:29.884
Они устали спорить.;Они избегают обсуждения проблемы.;Пара решила пойти на компромисс.;Что стало причиной этого?;0;;0000b4a8a2--5e707f2a9ca47b01255febc8;0000b4a8a2--5e707d5a1fcfde011aac093f;f0b2ba318c6405921ed1cd73bbe591a6;APPROVED;2020-03-17T07:41:30.610
Она наняла менеджера предвыборной кампании.;Она свидетельствовала в суде.;Женщина решила баллотироваться на государственные должности.;Что случилось в результате?;0;;0000b4a8a2--5e707f2a9ca47b01255febc8;0000b4a8a2--5e707d5a1fcfde011aac093f;f0b2ba318c6405921ed1cd73bbe591a6;APPROVED;2020-03-17T07:41:30.610
Он упаковал тёплую одежду в свой чемодан.;Он путешествовал с большим чемоданом.;Человек ожидал, что во время его поездки погода будет холодной.;Что случилось в результате?;0;;0000b4a8a2--5e707f2a9ca47b01255febc8;0000b4a8a2--5e707d5a1fcfde011aac093f;f0b2ba318c6405921ed1cd73bbe591a6;APPROVED;2020-03-17T07:41:30.610
Он поднял руку.;Он ушёл прочь.;Ученик знал ответ на вопрос.;Что случилось в результате?;0;;0000b4a8a2--5e707f2a9ca47b01255febc8;0000b4a8a2--5e707d5a1fcfde011aac093f;f0b2ba318c6405921ed1cd73bbe591a6;APPROVED;2020-03-17T07:41:30.610
Пыль попала в глаза.;Он надел очки на глаза.;Глаза человека заслезились.;Что стало причиной этого?;0;;0000b4a8a2--5e707f2a9ca47b01255febc8;0000b4a8a2--5e707d5a1fcfde011aac093f;f0b2ba318c6405921ed1cd73bbe591a6;APPROVED;2020-03-17T07:41:30.610
Спасатель прыгнул вслед за ним.;Мужчина обрызгал спасателя.;"Мужчина рухнул в бассейн ""бомбочкой"".";Что случилось в результате?;1;;0000b4a8a2--5e707f2ac83df801277af17c;0000b4a8a2--5e707d5a1fcfde011aac08e8;cf6984d6ee12cac0ede4b600b9c1b0e1;APPROVED;2020-03-17T07:41:30.074
Моя инфекция прошла.;Моя инфекция начала распространяться.;Я принимала антибиотики.;Что случилось в результате?;0;;0000b4a8a2--5e707f2ac83df801277af17c;0000b4a8a2--5e707d5a1fcfde011aac08e8;cf6984d6ee12cac0ede4b600b9c1b0e1;APPROVED;2020-03-17T07:41:30.074
Водитель нажал на тормоза.;Водитель посигналил.;На светофоре загорелся жёлтый.;Что случилось в результате?;0;;0000b4a8a2--5e707f2ac83df801277af17c;0000b4a8a2--5e707d5a1fcfde011aac08e8;cf6984d6ee12cac0ede4b600b9c1b0e1;APPROVED;2020-03-17T07:41:30.074
Я замочил контейнер в тёплой воде.;Я оставил контейнер на горячей плите.;Пластиковый контейнер расплавился.;Что стало причиной этого?;1;;0000b4a8a2--5e707f2ac83df801277af17c;0000b4a8a2--5e707d5a1fcfde011aac08e8;cf6984d6ee12cac0ede4b600b9c1b0e1;APPROVED;2020-03-17T07:41:30.074
Водитель врезался в столб.;Водитель проехал на красный свет.;Автомобиль получил вмятину.;Что стало причиной этого?;0;;0000b4a8a2--5e707f2ac83df801277af17c;0000b4a8a2--5e707d5a1fcfde011aac08e8;cf6984d6ee12cac0ede4b600b9c1b0e1;APPROVED;2020-03-17T07:41:30.074
Я слушал музыку.;Я готовил еду.;Мое настроение улучшилось.;Что стало причиной этого?;0;;0000b4a8a2--5e707f2b218d9b0125712f03;0000b4a8a2--5e707d5a1fcfde011aac090b;1839822b90bd88b0a24163bcf6c85454;APPROVED;2020-03-17T07:41:31.281
Они накормили бездомных.;Они провели аукцион.;Благотворительный фонд решил собрать деньги.;Что случилось в результате?;1;;0000b4a8a2--5e707f2b218d9b0125712f03;0000b4a8a2--5e707d5a1fcfde011aac090b;1839822b90bd88b0a24163bcf6c85454;APPROVED;2020-03-17T07:41:31.281
Пассажиры захихикали.;Пассажиры завопили.;Вагонетки американских горок помчались вниз с крутого обрыва.;Что случилось в результате?;1;;0000b4a8a2--5e707f2b218d9b0125712f03;0000b4a8a2--5e707d5a1fcfde011aac090b;1839822b90bd88b0a24163bcf6c85454;APPROVED;2020-03-17T07:41:31.281
Я проверил почтовый ящик при выходе из дома.;Я хлопнул дверью, покидая дом.;Я был в ярости.;Что случилось в результате?;1;;0000b4a8a2--5e707f2b218d9b0125712f03;0000b4a8a2--5e707d5a1fcfde011aac090b;1839822b90bd88b0a24163bcf6c85454;APPROVED;2020-03-17T07:41:31.281
Он отправился на север.;Он встал рано.;Мужчина хотел увидеть восход солнца.;Что случилось в результате?;1;;0000b4a8a2--5e707f2b218d9b0125712f03;0000b4a8a2--5e707d5a1fcfde011aac090b;1839822b90bd88b0a24163bcf6c85454;APPROVED;2020-03-17T07:41:31.281
Она хотела научиться рисовать.;Она хотела узнать о других культурах.;Женщина отправилась за границу.;Что стало причиной этого?;1;;0000b4a8a2--5e707f2b32ecfe0128be7f04;0000b4a8a2--5e707d5a1fcfde011aac0931;d5ee2c2689eac0c49a7146981a2e624c;APPROVED;2020-03-17T07:41:31.825
Его коллега получил повышение.;Его коллега работал допоздна.;Мужчина позавидовал своему коллеге.;Что стало причиной этого?;0;;0000b4a8a2--5e707f2b32ecfe0128be7f04;0000b4a8a2--5e707d5a1fcfde011aac0931;d5ee2c2689eac0c49a7146981a2e624c;APPROVED;2020-03-17T07:41:31.825
У него была галлюцинация.;У него была медитация.;Мужчина видел пришельцев.;Что стало причиной этого?;0;;0000b4a8a2--5e707f2b32ecfe0128be7f04;0000b4a8a2--5e707d5a1fcfde011aac0931;d5ee2c2689eac0c49a7146981a2e624c;APPROVED;2020-03-17T07:41:31.825
Он отбеливал их.;Он мыл их шампунем.;Волосы человека стали светлее.;Что стало причиной этого?;0;;0000b4a8a2--5e707f2b32ecfe0128be7f04;0000b4a8a2--5e707d5a1fcfde011aac0931;d5ee2c2689eac0c49a7146981a2e624c;APPROVED;2020-03-17T07:41:31.825
Она критиковал свои предыдущие работы.;Она ощутила прилив вдохновения.;Художница создала новую работу.;Что стало причиной этого?;1;;0000b4a8a2--5e707f2b32ecfe0128be7f04;0000b4a8a2--5e707d5a1fcfde011aac0931;d5ee2c2689eac0c49a7146981a2e624c;APPROVED;2020-03-17T07:41:31.825
Рыба выпрыгнула из аквариума.;Рыбы подплыли к еде.;Ребёнок насыпал в аквариум корм для рыб.;Что случилось в результате?;1;;0000b4a8a2--5e707f2b9df9dc0126bc6270;0000b4a8a2--5e707d5a1fcfde011aac0938;90d5ea1a3851d3410adcd286ad71ee0e;APPROVED;2020-03-17T07:41:31.884
Она поменяла свою партийную принадлежность.;Она участвует в акции протеста.;Политические взгляды этой женщины изменились.;Что случилось в результате?;0;;0000b4a8a2--5e707f2b9df9dc0126bc6270;0000b4a8a2--5e707d5a1fcfde011aac0938;90d5ea1a3851d3410adcd286ad71ee0e;APPROVED;2020-03-17T07:41:31.884
Я включил кран.;Я залил в неё жидкость для прочистки труб.;Раковина в ванной была засорена.;Что случилось в результате?;1;;0000b4a8a2--5e707f2b9df9dc0126bc6270;0000b4a8a2--5e707d5a1fcfde011aac0938;90d5ea1a3851d3410adcd286ad71ee0e;APPROVED;2020-03-17T07:41:31.884
Поезд прибыл на станцию.;Поезд издал гудок.;Пассажиры сошли с поезда.;Что стало причиной этого?;0;;0000b4a8a2--5e707f2b9df9dc0126bc6270;0000b4a8a2--5e707d5a1fcfde011aac0938;90d5ea1a3851d3410adcd286ad71ee0e;APPROVED;2020-03-17T07:41:31.884
Он поставил штамп на конверте.;Он запечатал конверт.;Мужчина надавил на влажный клапан конверта.;Что случилось в результате?;1;;0000b4a8a2--5e707f2b9df9dc0126bc6270;0000b4a8a2--5e707d5a1fcfde011aac0938;90d5ea1a3851d3410adcd286ad71ee0e;APPROVED;2020-03-17T07:41:31.884
Они были спелые.;Я поливала их.;Я собрала помидоры с куста.;Что стало причиной этого?;0;;0000b4a8a2--5e707f2bc4749501278d3bb4;0000b4a8a2--5e707d5a1fcfde011aac0915;e66404e39820fee911c40751b2bd96db;APPROVED;2020-03-17T07:41:31.022
Он пригласил свою бывшую девушку на обед.;Он купил подруге конфет.;Мужчина хотел быть романтичным.;Что случилось в результате?;0;;0000b4a8a2--5e707f2bc4749501278d3bb4;0000b4a8a2--5e707d5a1fcfde011aac0915;e66404e39820fee911c40751b2bd96db;APPROVED;2020-03-17T07:41:31.022
Я уронила градусник.;За окном становилось теплее.;Ртуть в градуснике поднялась.;Что стало причиной этого?;1;;0000b4a8a2--5e707f2bc4749501278d3bb4;0000b4a8a2--5e707d5a1fcfde011aac0915;e66404e39820fee911c40751b2bd96db;APPROVED;2020-03-17T07:41:31.022
Крыши со зданий сорвало.;Гололёд сделал трассы опасными.;Через город прошёл торнадо.;Что случилось в результате?;0;;0000b4a8a2--5e707f2bc4749501278d3bb4;0000b4a8a2--5e707d5a1fcfde011aac0915;e66404e39820fee911c40751b2bd96db;APPROVED;2020-03-17T07:41:31.022
Его оценки улучшились.;Он жульничал на экзамене.;Студент нанял репетитора.;Что случилось в результате?;0;;0000b4a8a2--5e707f2bc4749501278d3bb4;0000b4a8a2--5e707d5a1fcfde011aac0915;e66404e39820fee911c40751b2bd96db;APPROVED;2020-03-17T07:41:31.022
Я переработал бумагу.;Бумага помята.;Я сложил бумагу.;Что случилось в результате?;1;;0000b4a8a2--5e707f2ce5f258012725f3bf;0000b4a8a2--5e707d5a1fcfde011aac090a;14a90a7ea532172dc381b65d49af61ec;APPROVED;2020-03-17T07:41:32.048
Лидеры других стран сформировали союз.;Лидеры других стран направили помощь.;Страна пережила стихийное бедствие.;Что случилось в результате?;0;;0000b4a8a2--5e707f2ce5f258012725f3bf;0000b4a8a2--5e707d5a1fcfde011aac090a;14a90a7ea532172dc381b65d49af61ec;APPROVED;2020-03-17T07:41:32.048
Он выбрался из бассейна.;Он упал в бассейн.;Одежда мальчика промокла.;Что стало причиной этого?;1;;0000b4a8a2--5e707f2ce5f258012725f3bf;0000b4a8a2--5e707d5a1fcfde011aac090a;14a90a7ea532172dc381b65d49af61ec;APPROVED;2020-03-17T07:41:32.048
Её нужно было вернуть в библиотеку.;Он одолжил её у друга.;Студент спешил закончить книгу.;Что стало причиной этого?;0;;0000b4a8a2--5e707f2ce5f258012725f3bf;0000b4a8a2--5e707d5a1fcfde011aac090a;14a90a7ea532172dc381b65d49af61ec;APPROVED;2020-03-17T07:41:32.048
Он был брошен в тюрьму.;Он был осуждён за убийство.;Преступника казнили.;Что стало причиной этого?;1;;0000b4a8a2--5e707f2ce5f258012725f3bf;0000b4a8a2--5e707d5a1fcfde011aac090a;14a90a7ea532172dc381b65d49af61ec;APPROVED;2020-03-17T07:41:32.048
У неё был творческий кризис.;Она отредактировала проект.;Писательница пропустила все сроки представления проекта.;Что стало причиной этого?;0;;0000b4a8a2--5e707f2d4c82190116b9a374;0000b4a8a2--5e707d5a1fcfde011aac0920;458082d7dc5db64562b89974e4dfbc10;APPROVED;2020-03-17T07:41:33.098
Я просил поговорить с супервайзером.;Я предоставил мой идентификационный номер.;Сотрудник повесил трубку.;Что стало причиной этого?;0;;0000b4a8a2--5e707f2d4c82190116b9a374;0000b4a8a2--5e707d5a1fcfde011aac0920;458082d7dc5db64562b89974e4dfbc10;APPROVED;2020-03-17T07:41:33.098
Раздался звонок в дверь.;Шторы закачались.;Ветер подул через открытое окно.;Что случилось в результате?;1;;0000b4a8a2--5e707f2d4c82190116b9a374;0000b4a8a2--5e707d5a1fcfde011aac0920;458082d7dc5db64562b89974e4dfbc10;APPROVED;2020-03-17T07:41:33.098
Я вытащил вилку лампы из розетки.;Я пережёг предохранитель.;Электричество в моём доме отключилось.;Что стало причиной этого?;1;;0000b4a8a2--5e707f2d4c82190116b9a374;0000b4a8a2--5e707d5a1fcfde011aac0920;458082d7dc5db64562b89974e4dfbc10;APPROVED;2020-03-17T07:41:33.098
Он размял свои мышцы перед зеркалом.;Он поднял штангу над головой.;Тяжелоатлет крякнул.;Что стало причиной этого?;1;;0000b4a8a2--5e707f2d4c82190116b9a374;0000b4a8a2--5e707d5a1fcfde011aac0920;458082d7dc5db64562b89974e4dfbc10;APPROVED;2020-03-17T07:41:33.098
Он был хрупкий.;Он был небольшой.;Товар был упакован в пузырчатую пленку.;Что стало причиной этого?;0;;0000b4a8a2--5e707f2f3737ad01285231d1;0000b4a8a2--5e707d5a1fcfde011aac0943;986ce72779f88635205e7a1c86f6454d;APPROVED;2020-03-17T07:41:35.895
Я извлёк билет.;Я нашёл оружие.;Я опустошил свои карманы.;Что случилось в результате?;0;;0000b4a8a2--5e707f2f3737ad01285231d1;0000b4a8a2--5e707d5a1fcfde011aac0943;986ce72779f88635205e7a1c86f6454d;APPROVED;2020-03-17T07:41:35.895
Термиты исчезли из дома.;Термиты насквозь проели брёвна в доме.;В доме завелись термиты.;Что случилось в результате?;1;;0000b4a8a2--5e707f2f3737ad01285231d1;0000b4a8a2--5e707d5a1fcfde011aac0943;986ce72779f88635205e7a1c86f6454d;APPROVED;2020-03-17T07:41:35.895
Таможенник проверил их паспорта.;Таможенник обвинил их в контрабанде.;Путешественники добрались до границы.;Что случилось в результате?;0;;0000b4a8a2--5e707f2f3737ad01285231d1;0000b4a8a2--5e707d5a1fcfde011aac0943;986ce72779f88635205e7a1c86f6454d;APPROVED;2020-03-17T07:41:35.895
Дело было в праздничный день.;Дело было летом.;Офис был закрыт.;Что стало причиной этого?;0;;0000b4a8a2--5e707f2f3737ad01285231d1;0000b4a8a2--5e707d5a1fcfde011aac0943;986ce72779f88635205e7a1c86f6454d;APPROVED;2020-03-17T07:41:35.895
Они устали спорить.;Они избегают обсуждения проблемы.;Пара решила пойти на компромисс.;Что стало причиной этого?;0;;0000b4a8a2--5e707f308748990119991af5;0000b4a8a2--5e707d5a1fcfde011aac093f;94330ac6a17187fba72722af172f9ce1;APPROVED;2020-03-17T07:41:36.327
Она наняла менеджера предвыборной кампании.;Она свидетельствовала в суде.;Женщина решила баллотироваться на государственные должности.;Что случилось в результате?;0;;0000b4a8a2--5e707f308748990119991af5;0000b4a8a2--5e707d5a1fcfde011aac093f;94330ac6a17187fba72722af172f9ce1;APPROVED;2020-03-17T07:41:36.327
Он упаковал тёплую одежду в свой чемодан.;Он путешествовал с большим чемоданом.;Человек ожидал, что во время его поездки погода будет холодной.;Что случилось в результате?;0;;0000b4a8a2--5e707f308748990119991af5;0000b4a8a2--5e707d5a1fcfde011aac093f;94330ac6a17187fba72722af172f9ce1;APPROVED;2020-03-17T07:41:36.327
Он поднял руку.;Он ушёл прочь.;Ученик знал ответ на вопрос.;Что случилось в результате?;0;;0000b4a8a2--5e707f308748990119991af5;0000b4a8a2--5e707d5a1fcfde011aac093f;94330ac6a17187fba72722af172f9ce1;APPROVED;2020-03-17T07:41:36.327
Пыль попала в глаза.;Он надел очки на глаза.;Глаза человека заслезились.;Что стало причиной этого?;0;;0000b4a8a2--5e707f308748990119991af5;0000b4a8a2--5e707d5a1fcfde011aac093f;94330ac6a17187fba72722af172f9ce1;APPROVED;2020-03-17T07:41:36.327
Пацифисты устроили акцию протеста.;Пацифисты провели парад.;Гражданских жертв войны стало больше.;Что случилось в результате?;0;;0000b4a8a2--5e707f31aa2c2f24e8fcfa10;0000b4a8a2--5e707d5a1fcfde011aac0919;6c152fea2dd666f226faa73756d946ca;APPROVED;2020-03-17T07:41:37.854
Она привязала ленту.;Ленты выглядели так по-детски.;Девушка выдернула ленту из волос.;Что стало причиной этого?;1;;0000b4a8a2--5e707f31aa2c2f24e8fcfa10;0000b4a8a2--5e707d5a1fcfde011aac0919;6c152fea2dd666f226faa73756d946ca;APPROVED;2020-03-17T07:41:37.854
Он постарел.;Он помолодел.;Мужчина воспользовался услугами пластической хирургии.;Что случилось в результате?;1;;0000b4a8a2--5e707f31aa2c2f24e8fcfa10;0000b4a8a2--5e707d5a1fcfde011aac0919;6c152fea2dd666f226faa73756d946ca;APPROVED;2020-03-17T07:41:37.854
Яйцо проклюнулось.;Я разбил яйцо.;Из яйца появился цыпленок.;Что стало причиной этого?;0;;0000b4a8a2--5e707f31aa2c2f24e8fcfa10;0000b4a8a2--5e707d5a1fcfde011aac0919;6c152fea2dd666f226faa73756d946ca;APPROVED;2020-03-17T07:41:37.854
Он умер.;Он спасся бегством.;Заключённого морили голодом.;Что случилось в результате?;0;;0000b4a8a2--5e707f31aa2c2f24e8fcfa10;0000b4a8a2--5e707d5a1fcfde011aac0919;6c152fea2dd666f226faa73756d946ca;APPROVED;2020-03-17T07:41:37.854
Миллионер хотел, чтобы здание снесли.;Миллионер внёс средства на его постройку.;Здание было названо в честь миллионера.;Что стало причиной этого?;1;;0000b4a8a2--5e707f32b918b9011655cbfc;0000b4a8a2--5e707d5a1fcfde011aac092b;f30c634557aa6e39b048946a43f90c69;APPROVED;2020-03-17T07:41:38.846
Сотрудник отдела продаж увидел, как девушка положила товар в сумочку.;Сотрудник отдела продаж помог девушке найти кошелёк, который ей понравился.;Сотрудник отдела продаж обвинил девушку в краже.;Что стало причиной этого?;0;;0000b4a8a2--5e707f32b918b9011655cbfc;0000b4a8a2--5e707d5a1fcfde011aac092b;f30c634557aa6e39b048946a43f90c69;APPROVED;2020-03-17T07:41:38.846
Солдаты были отправлены в бой.;Солдаты были воссоединены со своими семьями.;Страна объявила войну на соседней территории.;Что случилось в результате?;0;;0000b4a8a2--5e707f32b918b9011655cbfc;0000b4a8a2--5e707d5a1fcfde011aac092b;f30c634557aa6e39b048946a43f90c69;APPROVED;2020-03-17T07:41:38.846
Перед зданием суда начались беспорядки.;Пара обменялись клятвами перед зданием суда.;Суд оставил в силе спорное решение.;Что случилось в результате?;0;;0000b4a8a2--5e707f32b918b9011655cbfc;0000b4a8a2--5e707d5a1fcfde011aac092b;f30c634557aa6e39b048946a43f90c69;APPROVED;2020-03-17T07:41:38.846
Она взяла печенье из банки.;Она забыла печенье в духовке.;Девушка почувствовала запах горелого.;Что стало причиной этого?;1;;0000b4a8a2--5e707f32b918b9011655cbfc;0000b4a8a2--5e707d5a1fcfde011aac092b;f30c634557aa6e39b048946a43f90c69;APPROVED;2020-03-17T07:41:38.846
Она пошла в библиотеку.;Она смотрела на звезды.;Девушка хотела узнать о Солнечной системе.;Что случилось в результате?;1;;0000b4a8a2--5e707f33dddbf7012599b15e;0000b4a8a2--5e707d5a1fcfde011aac090d;c0c9c355e3c65115da540836d3eb2aa5;APPROVED;2020-03-17T07:41:39.922
Я расположил плакат над дверью.;Я прилепил клейкую ленту к задней части плаката.;Плакат приклеился к стене.;Что стало причиной этого?;1;;0000b4a8a2--5e707f33dddbf7012599b15e;0000b4a8a2--5e707d5a1fcfde011aac090d;c0c9c355e3c65115da540836d3eb2aa5;APPROVED;2020-03-17T07:41:39.922
Архитектор построил здание.;Архитектор скорректировал план.;Клиент утвердил архитектору план строительства.;Что случилось в результате?;0;;0000b4a8a2--5e707f33dddbf7012599b15e;0000b4a8a2--5e707d5a1fcfde011aac090d;c0c9c355e3c65115da540836d3eb2aa5;APPROVED;2020-03-17T07:41:39.922
